Timestamp,"Product Owner facilitates user story development, prioritization and negotiation",Product Owner collaborates proactively with Product Management and other stakeholders,"User Stories are small, estimated, functional and vertical","Product owner facilitates development of acceptance criteria which are used in planning, review and story acceptance",Teams refine the backlog every sprint,Team participates fully in Release Planning and Inspect and Adapt,Product backlog for the PSI is itemized and prioritized,Teams proactively interact with other teams on the train as necessary to resolve impediments,"Team participates in System Demo every two weeks, illustrating real progress towards objectives",Team reliably meet 80-100% of non-stretch PSI Objecives,"Team plans the sprint collaboratively, effectively and efficiently","Team always has clear sprint goals, in support of PSI objectives, and commits to meeting them",Teams apply acceptance criteria and Definition of Done to story acceptance,"Team has a predictable, normalized velocity which is used for estimating and planning",Team regularly delivers on their sprint goals,"Team members are self-organized, respect each other, help each other complete sprint goals, manage interdependencies and stay in-sync with each other",Scrum Master attends Scrum of Scrums and interacts with RTE as appropriate,Stories are iterated through the sprint with multiple define-build-test cycles (e.g. the sprint is not a waterfalled),"Team holds collaborative, effective and efficient planning and daily meetings where all members participate, status is given clearly, issues are raised, obstacles are removed and information exchanged",Team holds a retrospective after each sprint and makes incremental changes to continually improve its performance,Teams actively reduce technical debt in each sprint,"Team has clear guidance and understanding of intentional architecture guidance, but is free and flexible enough to allow emergent design to support optimal implementation",Automated acceptance tests and unit tests are part of story DoD,Refactoring is always underway,"CI, build and test automation infrastructure is improving",What team are you reporting for?,What month are you reporting for?,"# of active, separate, parallel work threads",# of dedicated scrum masters,# of product owners,# of developers,# of quality assurance,How many new production defects were created this month?,"How many ""standard deployments""?","How many ""normal deployments""?","How many ""emergency deployments""?",Problem 1,Problem 2,Problem 3,Improvement 1,Improvement 2,Improvement 3,"What was your team's average committed velocity for the month, for all completed sprints?","What was your team's average delivered velocity for the month, for all completed sprints?","In hours, what was the average cycle time for a story, from development start to done, for the month?",How many stories were done this month?
3/31/2016 10:18:18,3,3,3,2,4,1,1,3,4,0,4,4,2,1,3,3,3,3,5,4,3,3,0,3,0,Business Platforms - Blue Team,3/31/2016,6,1,8,4,0,6,0,1,1,No dedicated QA,No proper analysis phase for release level plan,No automated testing,Involving the business,Formalized backlog grooming,Introduction of manual QA,91,116,64,72
3/31/2016 10:39:15,0,0,3,3,4,0,0,2,3,2,3,2,0,2,1,1,1,1,2,3,1,2,0,0,0,Business Platforms - Red Team,3/31/2016,3,1,0,2,0,0,0,0,0,No dedicated product owner,Low customer inolvement,No automated testing,Team trained & coached in story writing,Team trained & coached in estimation,Team exploring validation process,34,49,55,33
3/31/2016 13:33:27,4,3,2,2,4,2,4,2,5,5,3,4,3,1,3,4,1,3,4,4,4,4,0,1,2,.NET Application Development,3/31/2016,5,1,0,2,0,2,0,3,0,Support staff,Not having a BA,Not having QA,None,None,None,60,73,59,31
3/31/2016 14:11:04,3,3,3,3,4,3,3,4,5,5,4,4,4,2,2,4,4,3,5,2,3,3,0,3,0,Oracle - Human Resources,3/31/2016,9,1,5,5,0,0,0,3,0,NA,NA,NA,NA,NA,NA,134,95,95,49
3/31/2016 14:37:32,1,1,3,0,5,3,3,4,5,4,3,2,3,4,4,5,2,4,4,3,4,4,3,3,2,JEE Application Development,3/31/2016,5,1,0,4,0,5,0,3,0,No QA,No BAs,"Lack of business SMEs that articulate the business domain, and requirements",CI/CD,Cross training team,Rotating assignment to dedicated operations & support role ,76,81,59,31
3/31/2016 10:18:18,4,2,4,1,3,1,1,3,4,0,4,4,2,1,2,3,4,4,4,5,3,3,0,3,0,Business Platforms - Blue Team,4/30/2016,8,1,9,5,1,8,0,2,3,No dedicated QA,No proper analysis phase for release level plan,No automated testing,Involving the business,Formalized backlog grooming,Introduction of manual QA,80,90,50,70
